### ISSUE TITLE
 snmptthandler-embedded is changing hex engine ID value

### ISSUE THREAD

**Issue by ostap-dm** [snmptt/snmptt#19]
When using snmptthandler-embedded to read an engine ID from the snmp trap received from snmptrapd snmptt handler is changing hex value of the engine ID ever so slightly, so it won't be converted to a meaningful text. 
And example 
`   createUser -e "800099ee0474657874" community MD5 "231"`
But the translated engine id would look like this
`                 0x080099ee4047568747`

   snmptrapd.conf: |
```
    createUser -e "800099ee0474657874" test-community MD5 "testpass"
    authCommunity log,execute,net ciena-community
    authUser log,execute,net ciena-community noauth
    disableAuthorization no
      perl do "/usr/lib/snmptt/snmptthandler-embedded"
    agentAddress 127.0.0.1:162
```
    
  snmptt.ini: |
```
    [General]
    mode = "daemon"
    dns_enable = 1
    multiple_event = 1
    syslog_enable = 1
    # date_time_format = %Y-%m-%d %H:%M:%S %E
    [Logging]
    log_enable = 1
    log_file = /var/log/snmptt/snmptt.log
    log_system_enable = 1
    log_system_file = /var/log/snmptt/snmpttsystem.log
    unknown_trap_log_enable = 1
    unknown_trap_log_file = /var/log/snmptt/snmpttunknown.log
    [DaemonMode]
    spool_directory = /var/spool/snmptt/
    [Debugging]
    DEBUGGING = 2

    DEBUGGING_FILE = /var/log/snmptt/snmptt.debug
    [TrapFiles]
    snmptt_conf_files = <<END
    /etc/snmp/snmptt.conf
    END
```

  snmptt.conf: |
```

    EVENT linkDown .1.3.6.1.6.3.1.1.5.3 "Status Events" Normal
    FORMAT A linkDown trap signifies that the SNMP entity, $BE, $Be, $Bu, $Bn acting in $* 
    SDESC
    A linkDown trap signifies that the SNMP entity, acting in
    an agent role, has detected that the ifOperStatus object for
    one of its communication links is about to enter the down
    state from some other state (but not from the notPresent
    state).  This other state is indicated by the included value
    of ifOperStatus.
    Variables:
      1: ifIndex
      2: ifAdminStatus
      3: ifOperStatus
    EDESC

  snmptrapd.conf: |
    createUser -e "800099ee0474657874" test MD5 testtest
    authCommunity log,execute,net test
    authUser log,execute,net test noauth
    disableAuthorization no
      perl do "/usr/lib/snmptt/snmptthandler-embedded"
    agentAddress 127.0.0.1:162

```

  Trap packet capture
```
    18:31:38.454202 IP 172.x.x.x.53790 > portal.snmp-trap:  F=a U="test" E=_80_00_99_ee_04_74_65_78_74 C="" V2Trap(155)  system.sysUpTime.0=315872 S:1.1.4.1.0=E:39406.1.1.0.3 interfaces.ifTable.ifEntry.ifIndex.1=1 interfaces.ifTable.ifEntry.ifDescr.1="ethernet0/0" interfaces.ifTable.ifEntry.ifType.1=6 interfaces.ifTable.ifEntry.ifAdminStatus.1=1 interfaces.ifTable.ifEntry.ifOperStatus.1=1
    18:31:38.875519 IP 172.x.x.x.53790 > portal.snmp-trap:  F=a U="test" E=_80_00_99_ee_04_74_65_78_74 C="" V2Trap(155)  system.sysUpTime.0=315915 S:1.1.4.1.0=E:39406.1.1.0.4 interfaces.ifTable.ifEntry.ifIndex.1=1 interfaces.ifTable.ifEntry.ifDescr.1="ethernet0/0" interfaces.ifTable.ifEntry.ifType.1=6 interfaces.ifTable.ifEntry.ifAdminStatus.1=2 interfaces.ifTable.ifEntry.ifOperStatus.1=1
    18:31:41.357327 IP 172.x.x.x.53790 > portal.snmp-trap:  F=a U="test" E=_80_00_99_ee_04_74_65_78_74 C="" V2Trap(135)  system.sysUpTime.0=316163 S:1.1.4.1.0=S:1.1.5.3 interfaces.ifTable.ifEntry.ifIndex.1=1 interfaces.ifTable.ifEntry.ifAdminStatus.1=2 interfaces.ifTable.ifEntry.ifOperStatus.1=1 S:1.1.4.3.0=E:39406.1.2.1.19
```

  /var/log/snmptt/snmptt.debug
```
    Trap defined, processing...
    PREEXEC line(s):

    FORMAT line:
    Variable .1.3.6.1.2.1.2.2.1.8.1 with value 1
    Variable .1.3.6.1.2.1.2.2.1.7.1 with value 2
    Variable .1.3.6.1.2.1.2.2.1.1.1 with value 1
     Interface Down: The 2 interface on host oper-portal.benunets.com is down. IfIndex: 1
    .1.3.6.1.6.3.1.1.5.3 Critical "Status Events" 172.x.x.x -  Interface Down: The 2 interface on host oper-portal.benunets.com is down. IfIndex: 1
    
    EXEC line(s):
      EXEC line not defined
    Working with EVENT entry: .1.3.6.1.6.3.1.1.5.3 => linkDown,Status Events,Normal,
      No nodes defined for this entry so all nodes will match
      No MATCH entries defined for this entry

    Trap defined, processing...

    PREEXEC line(s):
    FORMAT line:
    Variable .1.3.6.1.2.1.2.2.1.8.1 with value 1
    Variable .1.3.6.1.2.1.2.2.1.7.1 with value 2
    Variable .1.3.6.1.2.1.2.2.1.1.1 with value 1
    A linkDown trap signifies that the SNMP entity, 0x080099ee4047568747, 0x080099ee4047568747, test, unknown acting in 1 2 1
    .1.3.6.1.6.3.1.1.5.3 Normal "Status Events" 172.x.x.x - A linkDown trap signifies that the SNMP entity, 0x080099ee4047568747, 0x080099ee4047568747, test, unknown acting in 1 2 1


    EXEC line(s):
      EXEC line not defined

```

snmptrapd logs
```
        2023-07-11 18:31:38 <UNKNOWN> [UDP: [172.x.x.x]:53790->[172.n.n.n]:162]:
        .1.3.6.1.2.1.1.3.0 = Timeticks: (315872) 0:52:38.72     .1.3.6.1.6.3.1.1.4.1.0 = OID: .1.3.6.1.4.1.39406.1.1.0.3        .1.3.6.1.2.1.2.2.1.1.1 = INTEGER: 1     .1.3.6.1.2.1.2.2.1.2.1 = STRING: ethernet0/0    .1.3.6.1.2.1.2.2.1.3.1 = INTEGER: ethernetCsmacd(6)   .1.3.6.1.2.1.2.2.1.7.1 = INTEGER: up(1) .1.3.6.1.2.1.2.2.1.8.1 = INTEGER: up(1) 
        2023-07-11 18:31:38 <UNKNOWN> [UDP: [172.x.x.x]:53790->[172.n.n.n]:162]:
        .1.3.6.1.2.1.1.3.0 = Timeticks: (315863) 0:52:38.63     .1.3.6.1.6.3.1.1.4.1.0 = OID: .1.3.6.1.6.3.1.1.5.4      .1.3.6.1.2.1.2.2.1.1.1 = INTEGER: 1     .1.3.6.1.2.1.2.2.1.7.1 = INTEGER: up(1) .1.3.6.1.2.1.2.2.1.8.1 = INTEGER: up(1) .1.3.6.1.6.3.1.1.4.3.0 = OID: .1.3.6.1.4.1.39406.1.2.1.19 
        2023-07-11 18:31:41 <UNKNOWN> [UDP: [172.x.x.x]:53790->[172.n.n.n]:162]:
        .1.3.6.1.2.1.1.3.0 = Timeticks: (316163) 0:52:41.63     .1.3.6.1.6.3.1.1.4.1.0 = OID: .1.3.6.1.6.3.1.1.5.3      .1.3.6.1.2.1.2.2.1.1.1 = INTEGER: 1     .1.3.6.1.2.1.2.2.1.7.1 = INTEGER: down(2)       .1.3.6.1.2.1.2.2.1.8.1 = INTEGER: up(1)       .1.3.6.1.6.3.1.1.4.3.0 = OID: .1.3.6.1.4.1.39406.1.2.1.19 
```

**Comment by AlexB7** [comment]
snmptt.ini option engine_id_hex has been added to allow you to disable pre-pending the securityEngineID ($Be) and contextEngineID ($BE) with 0x.  It will be available in 1.5.1.
